{
  "phase": 1,
  "phase_name": "design-orchestrate",
  "kind": "stage_packet_index",
  "entries": [
    {
      "logical_phase_id": "feature_develop",
      "logical_phase_name": "feature-develop",
      "entry_doc": "controls/design_orchestrate/handoff_to_feature_develop.json"
    },
    {
      "logical_phase_id": "test_develop",
      "logical_phase_name": "test-develop",
      "entry_doc": "controls/feature_develop/handoff_p2_to_p3.json"
    },
    {
      "logical_phase_id": "build_verify",
      "logical_phase_name": "build-verify",
      "entry_doc": "controls/test_develop/handoff_p3_test_develop.json"
    },
    {
      "logical_phase_id": "test_author",
      "logical_phase_name": "test-author",
      "entry_doc": "controls/build_verify/handoff_to_test_author.json"
    },
    {
      "logical_phase_id": "device_functional",
      "logical_phase_name": "device-functional",
      "entry_doc": "controls/test_author/handoff_to_device_functional.json"
    },
    {
      "logical_phase_id": "quality_verify",
      "logical_phase_name": "quality-verify",
      "entry_doc": "controls/quality_verify/handoff_to_upload_review.json"
    },
    {
      "logical_phase_id": "upload_review",
      "logical_phase_name": "upload-review",
      "entry_doc": "controls/upload_review/completion_receipt.json"
    }
  ],
  "control_protocol_version": 1
}